X,Y,Name,description
30.500663,50.381614,"2749","<img src=""https://lh4.googleusercontent.com/PJRE1mKa1PFOvvPGwAVw-hbcx7wjfPHAj2PHeszsymYJQnbZSrz_oi2lmHyXEgY2jcv62BVJz02fKxgUg9CydrJOSyMRuY6mVkUSVFruySJ7xBO2YFu3uKwCsHZS89NTA6GOUg"" height=""200"" width=""auto"" /><br><br>Назва: Гіркокаштан м`ясочервоний<br>Латинська назва: Aesculus carnea Hayne<br>Діаметр: 1,5<br>Опис: Дерево 15–25 м висотою, дуже схоже на A. hippocastanum. Відрізняється лише клейкими бруньками, завжди голими молодими гілками. Гібрид гіркокаштана звичайного (Aesculus hippocastanum L.) і гіркакаштана павіа (Aesculus pavia L.) отриманий у 1818 році.<br>Санітарний стан: <br>Екосистемні послуги : <br><br><img src=""https://lh4.googleusercontent.com/zZsfUpYvBO1xFEZ1NGgdRHg0X5lHWACU1NUcq_WrrUkXGsIH2aFvSCSYo51X0E_MgCL9x1K7zOB80w76to9zC45DWhTNUgJJzf2yc2Z9AdJ3Jwg9RU82KRRhaFjYhEgJE6WkEA"" height=""200"" width=""auto"" />"
30.500699,50.381635,"2750","Назва: Туя гігантська<br>Латинська назва: Thuja plicata Lamb.<br>Діаметр: 18<br>Опис: Хвойне дерево, може досягати 50 м заввишки при діаметрі стовбура 2,5 м. Доросле дерево відрізняється густою щільною кроною, його нижні гілки під власною вагою звисають до самої землі. Лускоподібна хвоя розташована хрестоподібно. Має широкі пагони з яскраво-зеленими і жовтими кінчиками. В цілому, туя має пірамідальний вигляд. Теплолюбна рослина, підмерзає в суворих зимових умовах, при дуже низьких температурах може всохнути. Широко застосовується для створення алей, живих стін і огорож. Завдяки невибагливості і стійкості до міських умов є перспективною для озелененні міст. Природно поширена на теренах Північної Америки.<br><br>Санітарний стан: <br>Екосистемні послуги : Приріст фітомаси - 0,51 кг/рік<br>Депонування вуглецю - 0,25  кгС/рік, 0,21 грн/рік<br>Акумулювання енергії - 9,12 МДж 0,69 грн/рік<br>Продукування кисню - 0,71 кг/рік "
30.500702,50.381632,"2751","<img src=""https://lh5.googleusercontent.com/zStFX3wY7nyv-5VdwqGCp8Me7RcIK6eqiwAsVzJzHNQmOSah3jri_LaBMUGGNbTCQB44IZOPyqSBZzD0EW_Iy3FbmnzLBn4wYSbT0Do04x5iS4n6_xzsc3zwboUFM-IUmF1X5g"" height=""200"" width=""auto"" /><br><br>Назва: Туя західна<br>Латинська назва: Thuja occidentalis L.<br>Діаметр: 18<br>Опис: ""Вічнозелене однодомне дерево до 20 (30) м заввишки із стовбуром більше 1 м в діаметрі. Хвоя темно-жовтувато-зелена, із смоляними залозами. Пагони потовщені. Стиглі шишки донизу відігнуті, світло-коричневі або коричнево-бурі, видовженоовальні, їхні луски шкірясто-дерев'янисті, черепичасто налягають одна на одну. Запилюється у першій половині квітня. Насіння достигає у рік запилення. Морозостійка. <br>В культурі ві-дібрано багато декоративних форм, особливо ціняться форми з пірамідаль-ною кроною і золотистою хвоєю.<br>В деревині туї містяться ефірні масла, що надають рослині приємний аромат. <br>У народній медицині тую західну використовують як діуретичний, жо-вчогінний, відхаркувальний, потогінний, кровоспинний, антисептичний і та-кий, що викликає гіперемію, засіб. При зовнішньому застосуванні позитив-ний терапевтичний ефект спостерігається при лікуванні запалення волосяних мішечків шкіри (обмивання настоєм), червоного вовчака і ознобишів (змащу-вання настойкою), при виведенні бородавок (посипання порошком, змащу-вання свіжим соком або настойкою). Природний ареал – схід Північної Америки. <br>""<br>Санітарний стан: <br>Екосистемні послуги : <br><br><img src=""https://lh3.googleusercontent.com/makoZ1WfZsBEN56ueByYwsxCwVe_1MZX1gW5aiAxE5FLtiHQPnCkXfm9Vlqup9PD_wsRCfA1nAwj6d6gwSFVEfMKb-XN7HiDgQWmOH0Ci7lwdKh8d6-khMrPFRx3mY6V5g_dCg"" height=""200"" width=""auto"" />"
30.500689,50.38161,"2752","Назва: Туя гігантська<br>Латинська назва: Thuja plicata Lamb.<br>Діаметр: 22<br>Опис: Хвойне дерево, може досягати 50 м заввишки при діаметрі стовбура 2,5 м. Доросле дерево відрізняється густою щільною кроною, його нижні гілки під власною вагою звисають до самої землі. Лускоподібна хвоя розташована хрестоподібно. Має широкі пагони з яскраво-зеленими і жовтими кінчиками. В цілому, туя має пірамідальний вигляд. Теплолюбна рослина, підмерзає в суворих зимових умовах, при дуже низьких температурах може всохнути. Широко застосовується для створення алей, живих стін і огорож. Завдяки невибагливості і стійкості до міських умов є перспективною для озелененні міст. Природно поширена на теренах Північної Америки.<br><br>Санітарний стан: <br>Екосистемні послуги : Приріст фітомаси - 0,68 кг/рік<br>Депонування вуглецю - 0,34  кгС/рік, 0,29 грн/рік<br>Акумулювання енергії - 12,30 МДж 0,93 грн/рік<br>Продукування кисню - 0,01 кг/рік "
30.500696,50.381617,"2753","Назва: Туя гігантська<br>Латинська назва: Thuja plicata Lamb.<br>Діаметр: 28<br>Опис: Хвойне дерево, може досягати 50 м заввишки при діаметрі стовбура 2,5 м. Доросле дерево відрізняється густою щільною кроною, його нижні гілки під власною вагою звисають до самої землі. Лускоподібна хвоя розташована хрестоподібно. Має широкі пагони з яскраво-зеленими і жовтими кінчиками. В цілому, туя має пірамідальний вигляд. Теплолюбна рослина, підмерзає в суворих зимових умовах, при дуже низьких температурах може всохнути. Широко застосовується для створення алей, живих стін і огорож. Завдяки невибагливості і стійкості до міських умов є перспективною для озелененні міст. Природно поширена на теренах Північної Америки.<br><br>Санітарний стан: <br>Екосистемні послуги : Приріст фітомаси - 0,75 кг/рік<br>Депонування вуглецю - 0,37  кгС/рік, 0,31 грн/рік<br>Акумулювання енергії - 13,46 МДж 1,02 грн/рік<br>Продукування кисню - 0,01 кг/рік "
30.500693,50.381622,"2754","<img src=""https://lh5.googleusercontent.com/uj-6Cha5WDspcq1NrBFwqa3hWF2hb-RPKG4mu94fqwfILKYyjcDh5BeymFoNQgTdkBGSa3fgdquAJP91JKVVyqZfnKdjSnrWcRXucVvPebk2Mns1js70IM320cIYTQ5jIM0_UeA"" height=""200"" width=""auto"" /><br><br>Назва: Горіх сірий<br>Латинська назва: Juglans cinerea L.<br>Діаметр: 22<br>Опис: Дерево до 30 м заввишки з ажурною, щатроподібною кроною. Діаметр стовбура до 1 м та більше. Кора темно-сіра тріщинувата, молоді пагони оливково-зелені, потім пурпурно-бурі, вкриті сочевичками. Відзначається залозистоопушеними пагонами і гостропилчастими опушеними листочками. Батьківщина — Північна Америка (США, Канада).<br>Санітарний стан: <br>Екосистемні послуги : Приріст фітомаси - 7,15 кг/рік<br>Депонування вуглецю - 3,58 кгС/рік - 3,00 грн/рік<br>Акумулювання енергії - 127,90 МДж - 9,72 грн/рік<br>Продукування кисню - 2,88 кг/рік<br><br><img src=""https://lh5.googleusercontent.com/hehSBYVvK-6iYJ4-tlUBfHZiHZdVygpqN8PGsSr_rmLNQ77HNkXJRgdDLHUbyfY4QV_ZgQ-FLjJmT-S-q2q5aQJzrRAhj9JnOhwRhCfLSxavVRr8lPYV9eX0YNNCwwFNFOqB"" height=""200"" width=""auto"" />"
30.500716,50.381645,"2755","<img src=""https://lh5.googleusercontent.com/E3obZkVUnD-JC1rB8skTdA9Z-HDQLV0NyDZZgL9U8bSxlBDzNWvk_LV6zP6drmDUOwstqM2PKn0iZtLVfVGOCDqHGyhUNReeY01fk9ct-KD28AYulfikm7h6Tm8gaCt2sfIsVA"" height=""200"" width=""auto"" /><br><br>Назва: Береза повисла<br>Латинська назва: Betula pendula Roth.<br>Діаметр: 18<br>Опис: Дерево 10-20 м заввишки з гладенькою білою корою, при основі стовбура кора чорно-сіра, глибокотріщинувата. Крона ажурна з повислими гілками. Молоді пагони червоно-бурі, густо вкриті смолистими бородавками. Світлолюбна, морозостійка рослина. Береза повисла росте в соснових, мішаних і листяних лісах. Зрідка утворює чисті лісостани, особливо в похідних деревостанах. Береза повисла росте природно від Західної Європи на схід до Казахстану, в Республіці Саха в Сибіру, Монголії і провінції Синьцзян в Китаї, і на південь до гір Кавказу і Північного Ірану, Іраку і Туреччини. <br>Санітарний стан: <br>Екосистемні послуги : Приріст фітомаси -5,98 кг/рік<br>Депонування вуглецю - 2,99 кгС/рік - 2,51 грн/рік<br>Акумулювання енергії - 106,96 МДж - 8,12 грн/рік<br>Продукування кисню -0,86 кг/рік<br><br><img src=""https://lh6.googleusercontent.com/cF0j1Sh7nJ1N9wfQyx6fNfenWcCEFq48AeV3DsA_E1rIJEd2lCOd7qd-gqEJ8-kgRu6imdOIjB8_cjYru4_DYH7zc1zq7pbKb4TUbDyZ0QvQDRV4QQ0H7rwmwzC6v8Qz1Jd-Cb8"" height=""200"" width=""auto"" /><br><br><img src=""https://lh4.googleusercontent.com/--6gH11hj3kO95nK5LtDGgmGaV47oA7gTH94J6NmKXyoMd0VPYInAUeo92HSkHi4R-CMQGxtKtMNhDvy0g4cOwQD5VTb4eionhJFP75QW7roiB0gWLDKYx0r6pDeZqZAc3WnCg"" height=""200"" width=""auto"" />"
30.500746,50.381686,"2756","<img src=""https://lh6.googleusercontent.com/XAr-BDCyLfLPYD5BC9s40Xworei0VIAa0U33zyCdUypzTUu1gF7QhOTQxduvCdG6-V-WpP8fosPDobBNdd5J0qogQqWXzfr8W41p-MrNZdNKIArhpJEj5sr67ZbUThtYBV7zBmE"" height=""200"" width=""auto"" /><br><br>Назва: Дуб болотний  <br>Латинська назва: Quercus palustris Muench. <br>Діаметр: 14<br>Опис: Струнке дерево заввишки до 25 м. Кора стовбура зеленувато-коричнева, довго залишається гладкою. У природі зростає на глибоких влогих грунтах вздовж берегів річок та боліт. Перспективний для широкого застосування в озелененні та парковому будівництві. Батьківщина - Північна Америка.  <br>Санітарний стан: <br>Екосистемні послуги : Приріст фітомаси - 35,29 кг/рік<br>Депонування вуглецю - 3,07 кгС/рік - 2,58 грн/рік<br>Акумулювання енергії - 109,96 МДж - 8,36 грн/рік<br>Продукування кисню -0,80 кг/рік<br><br><img src=""https://lh4.googleusercontent.com/OnPXhg87szDl8vDbFUgaKheUxtS0EZfBKAS8og2YYn4NqF0Bud2X1qyJbSW3TI2D-6YFAabWNZA_nG0oG24eFTdJoGSPDeoRXt-eSkTd0U89-TZmv5d9mQTINEG9rL7nAzVGtA"" height=""200"" width=""auto"" />"
30.500785,50.381736,"2757","<img src=""https://lh6.googleusercontent.com/VB50D3UcIYHBqiiVjk1WTDsgFhwf5M3m582ZydvPPtftRQ6gg0Du7Mx3pyIXvmFw5rQP1RspCegcDOPD7EjZXSb3a-c5mmKs4CHELysRuPdlZ3xWnNuzWJVt9WrJy-0ULw3AhfY"" height=""200"" width=""auto"" /><br><br>Назва: Жимолость татарська<br>Латинська назва: Lonicera tatarica L.<br>Діаметр: <br>Опис: ""Листопадний чагарник висотою до 5 м. Листки яйцевидні довжиною до 6 см. Квітки від білих до червоних, з приєм-ним ароматом. Плоди отруйні – кулясті, червоні або оранжеві ягоди. Досить декоративна весною під час квітування та восени після дозрівання червоних та оранжевих плодів. Морозостійка. Посухостійка та солевитривала. <br>Витримує пе-ресадку навіть у дорослому стані та будь-якої пори року. Добре витримує стрижку. Рекомендована для створення живоплотів, групових та солітер них посадок. Існує багато форм та гібридних сортів, які відрізняються розмірами та забарвленням квіток та плодів. Природно зростає на значних територіях від Волги до Байкала.<br>""<br>Санітарний стан: <br>Екосистемні послуги : <br><br><img src=""https://lh3.googleusercontent.com/NqJOB6l3qVLUr2umXAPSdhTciLl-4Gy8Lawy9bmLu-mbadDiok5Oi28BHR0dF3Ziwolc0sIIjWFkxdPNeRiwTmVxGXpAHQ2yCI5RRKQDbEEnUWxSlvrMHfDCSiVb6wYgUJTM"" height=""200"" width=""auto"" />"
30.500725,50.381739,"2758","<img src=""https://lh6.googleusercontent.com/1TOJWOWbW1I9zancMHJvDqIuzktULMdsM9QROA8Dn4aI9c8zJCTb7plKWnGJbrfhyFeIdFJaocpAI4eRttARk5AtFxbZINh8K-xuyYsoOIw4_hPJfeqIzGPdiil31plEJ_UU"" height=""200"" width=""auto"" /><br><br>Назва: Дуб болотний  <br>Латинська назва: Quercus palustris Muench. <br>Діаметр: 14<br>Опис: Струнке дерево заввишки до 25 м. Кора стовбура зеленувато-коричнева, довго залишається гладкою. У природі зростає на глибоких влогих грунтах вздовж берегів річок та боліт. Перспективний для широкого застосування в озелененні та парковому будівництві. Батьківщина - Північна А.мерика.  <br>Санітарний стан: <br>Екосистемні послуги : Приріст фітомаси -6,15 кг/рік<br>Депонування вуглецю - 3,08 кгС/рік - 2,58 грн/рік<br>Акумулювання енергії - 109,96 МДж - 8,36 грн/рік<br>Продукування кисню -0,80 кг/рік<br><br><img src=""https://lh5.googleusercontent.com/NZpIjNpVfgh4yXO2pLGkUsU3nC2sGmhRlpJHotc6ChDy9xf4b2VuBXwE0yrv6bfo7FJZlIzxBpgNBmaHtWdKbM1zk5eut3sA04QAoY8qIcoNObwgNZAj6XSgL51Gll3hfX19CQ"" height=""200"" width=""auto"" />"
30.500683,50.381713,"2759","<img src=""https://lh5.googleusercontent.com/LLfopl8S_rfT1Nz4qHPSMY2HdkfD3um_FV0KfRKGT9YpaZQmzOFwpb2dbstGUsUgKoomDFi28c5_6W2jmf6MXAq6bNOqBnZ6pBhztH5VXy6giShkt8HnX3WS7bdBLN4kgKmGkoA"" height=""200"" width=""auto"" /><br><br>Назва: Туя західна<br>Латинська назва: Thuja occidentalis L.<br>Діаметр: 25<br>Опис: ""Вічнозелене однодомне дерево до 20 (30) м заввишки із стовбуром більше 1 м в діаметрі. Хвоя темно-жовтувато-зелена, із смоляними залозами. Пагони потовщені. Стиглі шишки донизу відігнуті, світло-коричневі або коричнево-бурі, видовженоовальні, їхні луски шкірясто-дерев'янисті, черепичасто налягають одна на одну. Запилюється у першій половині квітня. Насіння достигає у рік запилення. Морозостійка. <br>В культурі ві-дібрано багато декоративних форм, особливо ціняться форми з пірамідаль-ною кроною і золотистою хвоєю.<br>В деревині туї містяться ефірні масла, що надають рослині приємний аромат. <br>У народній медицині тую західну використовують як діуретичний, жо-вчогінний, відхаркувальний, потогінний, кровоспинний, антисептичний і та-кий, що викликає гіперемію, засіб. При зовнішньому застосуванні позитив-ний терапевтичний ефект спостерігається при лікуванні запалення волосяних мішечків шкіри (обмивання настоєм), червоного вовчака і ознобишів (змащу-вання настойкою), при виведенні бородавок (посипання порошком, змащу-вання свіжим соком або настойкою). Природний ареал – схід Північної Америки. <br>""<br>Санітарний стан: <br>Екосистемні послуги : Приріст фітомаси - 6,30 кг/рік<br>Депонування вуглецю - 3,15 кгС/рік, - 2,64грн/рік<br>Акумулювання енергії - 112,59 МДж - 8,56 грн/рік<br>Продукування кисню -3,74 кг/рік<br><br><img src=""https://lh5.googleusercontent.com/n5t2vnSg_nIHcwZhMgcE_dZDcxW6kDj3GQkdX4JVYk7TDFHlUySYSeqDCPIO2pHRmKH4KQs1FCSZ6EorAxsG5dxMbTIowJ_mEpWMQePOvN17mb0v4oAPpP02valBShqh9tIW3n8"" height=""200"" width=""auto"" />"
30.500646,50.381745,"2760","Назва: В'яз гладенький<br>Латинська назва: Ulmus laevis Pall. <br>Діаметр: 6<br>Опис: ""Дерево до 15—30 м заввишки з товстим стовбуром, вкритим буро-коричневою корою. Молоді пагони червонувато-бурі, опушені, гілки тонкі, гладенькі, блискучі, бруньки гострі, конічні.Квітки двостатеві з коричнюватою, простою, дзвоникуватою, восьмилопатевою оцвітиною (до 8—11 мм у діаметрі) на довгих (до 2 см) квітконіжках. Тичинок 6—8, пиляки темно-фіолетові, зав'язь верхня. Плід — горішок, оточений крилоподібним виростом. Крилатка (12—16 мм завдовжки) округла або овальна, у верхній частині виїмчаста, по краю війчаста, плодоніжка довга, у 2—5 разів перевищує плід. Горішок розміщений у центрі крила.<br>В'яз гладкий входить до складу дубово-широколистяних лісів, особливо часто росте на узліссях і галявинах. Солевитривала, світлолюбна рослина. Квітне у квітні — червні.""<br>Санітарний стан: <br>Екосистемні послуги : Приріст фітомаси - 1,16 кг/рік<br>Депонування вуглецю - 0,58 кгС/рік - 0,49 грн/рік<br>Акумулювання енергії - 20,81МДж - 1,58 грн/рік<br>Продукування кисню - 0,61 кг/рік"
30.500597,50.381776,"2761","<img src=""https://lh4.googleusercontent.com/YN30han66N2CPXqKVtWoGfJbpdbpNFnq-6c0jcxvqtB6YUltpw7zyo5ajrxhnin8tLyMsWsn8ym993gXwYwe__9iyiM-8A_387Hs5UmpR63N6cpz-skhNa_F6KZZYZ_TtVcXWQ"" height=""200"" width=""auto"" /><br><br>Назва: Айва довгаста<br>Латинська назва: Cydonia oblonga Mill.<br>Діаметр: 18<br>Опис: Айва росте як багатостовбурний чагарник або невелике дерево до 7 м у висоту, з опушеними бруньками, черешками листя, листям і плодами. Має гіркі, жовті, грушоподібні плоди, які використовуються для приготування консервів. Батьківщиною вважаються Кавказ і Середня Азія. <br>Санітарний стан: <br>Екосистемні послуги : <br><br><img src=""https://lh3.googleusercontent.com/CDlumJTbLw0BFpqSpBtD1USe0yyKW8tVQe6S-JAUqvHc01ieJGs-bFFPmHHzhroLiDdNTAGoAcNjO6uTwk_aIROmcyotoD3MgTX-j4s5NzkmS4b62DQFjLFH7LzvMjK5xjMyi0c"" height=""200"" width=""auto"" /><br><br><img src=""https://lh6.googleusercontent.com/XW8-iGoJ4dM8KT6Swo1FnQPLySYgZQjCZRXB-dwwfIML3q7r-qHTxvnxFJ542KSnO67xSTOo75WkBh878CeXi8y3Rpt17ySs3Xpmhh54zuK7GB_T86rmbxVaE_CioHze_pDAQho"" height=""200"" width=""auto"" />"
30.500576,50.381717,"2762","<img src=""https://lh3.googleusercontent.com/S91Uql0yhFa8C80X8IfWn049ny9lCPH3jFt9-qGy_BG98muyjo6Vr3PsNdpDnILjZ9OMvWZXUqPP61_RVKP0crG33F5jbbP0SHe7bXgJB2kFkauHIQ_b-_eq1mydoRrE3TE7-g"" height=""200"" width=""auto"" /><br><br>Назва: Ялина європейська<br>Латинська назва: Picea abies (L.) Karst.<br>Діаметр: 15<br>Опис: Кора сіра або червонувато-бура з дугоподібними вертикальними тріщинами або лусками. Молоді пагони зелені з загостреними буруватими бруньками. Хвоя розміщена почергово, шорстка, колюча, чотиригранна (1,3-2,5 см завдовжки), загострена, блискуча, тримається 5-6 (12) років. Тіньовитривала, морозостійка рослина. Танідоносна, деревинна, смолоносна, лікарська, медоносна, жироолійна, ефіроолійна, вітамінозна, кормова і декоративна рослина. Поширена в Карпатах, рідше у Прикарпатті, місцями в західному та лівобережному Поліссі, західному і волинському Лісостепу.<br>Санітарний стан: <br>Екосистемні послуги : Приріст фітомаси - 3.25 кг/рік<br>Депонування вуглецю - 1.62 кгС/рік, 1.36 грн/рік<br>Акумулювання енергії - 58.04 МДж - 4.41 грн/рік<br>Продукування кисню - 2.15 кг/рік <br><br><img src=""https://lh6.googleusercontent.com/GSh7o0xU74xMD8-NUcGojPsE63b3HkZD9TRvAAVMjEfIB_Jq6IKqatcaf6ybwjw8Zw6GHSdmg-CYeN_URkuU95-BBx4Zv7d5RndmcOfwQu1jCC89fyTpZTrqqpIKs7Ho7m7YHg"" height=""200"" width=""auto"" /><br><br><img src=""https://lh5.googleusercontent.com/9tcR1C1_wZilpOJ3ufrtvKeNO0VO2J3WjePGLUo8YdOON3_O1o5MCV22o_NtnR5kGC-P4fEqXpZFgdwND2K9WmGHPMapn9GRnwCY3TPzwV_-B-nJVuq73c0ucU3uREGoAQLMRw"" height=""200"" width=""auto"" />"
